{
  "$schema": "https://json-schema.org/draft/2020-12/schema",
  "$id": "https://local/自動化輸出/schemas/post.schema.json",
  "title": "post.json",
  "description": "階段 4 產物：一則貼文的圖卡清單與各平台文案。一篇文章可能有 1–3 則，各自一個 out/<slug>/p<N>/post.json",
  "type": "object",
  "required": [
    "schema_version",
    "generated_at",
    "source",
    "post_index",
    "angle",
    "images",
    "posts"
  ],
  "additionalProperties": false,
  "properties": {
    "schema_version": {
      "const": "3.0"
    },
    "generated_at": {
      "type": "string",
      "format": "date-time"
    },
    "model": {
      "type": "string"
    },
    "source": {
      "$ref": "#/$defs/source"
    },
    "images": {
      "type": "array",
      "minItems": 1,
      "items": {
        "$ref": "#/$defs/image"
      }
    },
    "posts": {
      "type": "array",
      "minItems": 1,
      "items": {
        "$ref": "#/$defs/post"
      }
    },
    "post_index": {
      "type": "integer",
      "minimum": 1,
      "maximum": 3,
      "description": "1-based，對應 highlights.posts 的順序"
    },
    "angle": {
      "type": "string",
      "minLength": 1,
      "description": "這則貼文的論點（封面標題）"
    }
  },
  "$defs": {
    "source": {
      "type": "object",
      "required": [
        "slug",
        "title",
        "author"
      ],
      "properties": {
        "slug": {
          "type": "string",
          "pattern": "^[a-z0-9][a-z0-9-]*$"
        },
        "title": {
          "type": "string",
          "minLength": 1
        },
        "author": {
          "type": "string",
          "minLength": 1
        },
        "url": {
          "type": "string",
          "format": "uri"
        },
        "file": {
          "type": "string"
        }
      }
    },
    "image": {
      "type": "object",
      "required": [
        "path",
        "role",
        "ratio"
      ],
      "additionalProperties": false,
      "properties": {
        "path": {
          "type": "string",
          "pattern": "^images/\\d{2}_(cover|point|steps|contrast|quote|outro)(_\\d+)?\\.(png|jpg)$",
          "description": "相對於 out/<slug>/ 的路徑"
        },
        "role": {
          "enum": [
            "cover",
            "point",
            "steps",
            "contrast",
            "quote",
            "outro"
          ]
        },
        "ratio": {
          "enum": [
            "1:1",
            "4:5"
          ]
        },
        "bytes": {
          "type": "integer",
          "minimum": 1
        },
        "card_index": {
          "type": "integer",
          "minimum": 1,
          "description": "1-based，對應 highlights.posts[].cards 的順序；封面與結尾不需要"
        }
      },
      "allOf": [
        {
          "if": {
            "properties": {
              "role": {
                "enum": [
                  "point",
                  "steps",
                  "contrast",
                  "quote"
                ]
              }
            }
          },
          "then": {
            "required": [
              "card_index"
            ]
          }
        }
      ]
    },
    "post": {
      "type": "object",
      "required": [
        "platform",
        "caption",
        "image_paths",
        "attribution"
      ],
      "additionalProperties": false,
      "properties": {
        "platform": {
          "enum": [
            "instagram",
            "threads"
          ]
        },
        "caption": {
          "type": "string",
          "minLength": 1,
          "maxLength": 2200,
          "description": "含出處標註的完整貼文文字，可直接複製貼上。Threads 需 ≤ 500 字（由模組自檢）"
        },
        "hashtags": {
          "type": "array",
          "items": {
            "type": "string",
            "pattern": "^#\\S+$"
          }
        },
        "image_paths": {
          "type": "array",
          "minItems": 1,
          "description": "發布時的排圖順序",
          "items": {
            "type": "string",
            "pattern": "^images/"
          }
        },
        "attribution": {
          "type": "string",
          "minLength": 1,
          "description": "原文出處：標題 + 作者 + 連結"
        }
      }
    }
  }
}